{
  "opendb_id": "6cdb0c83-f2f6-4649-a4ac-f4ce28976776",
  "layout": "ANSI",
  "features": [],
  "connectivity": [],
  "metadata": {
    "name": "Corsair K65 PLUS RGB Wired/Wireless Gaming Keyboard",
    "manufacturer": "Corsair",
    "part_numbers": ["CH-91D401L-ES"]
  },
  "general_product_information": {},
  "identifiers": {
    "version": 1,
    "identifiers": [
      {
        "type": "mpn",
        "value": "CH-91D401L-ES",
        "region": "all"
      }
    ],
    "retailer_listings": [
      {
        "source": "corsair",
        "channel": "ca",
        "source_product_id": "CH-91D401L-ES",
        "pricing_enabled": true,
        "verified": false
      },
      {
        "source": "corsair",
        "channel": "de",
        "source_product_id": "CH-91D401L-ES",
        "pricing_enabled": true,
        "verified": false
      },
      {
        "source": "corsair",
        "channel": "es",
        "source_product_id": "CH-91D401L-ES",
        "pricing_enabled": true,
        "verified": false
      },
      {
        "source": "corsair",
        "channel": "fr",
        "source_product_id": "CH-91D401L-ES",
        "pricing_enabled": true,
        "verified": false
      },
      {
        "source": "corsair",
        "channel": "it",
        "source_product_id": "CH-91D401L-ES",
        "pricing_enabled": true,
        "verified": false
      },
      {
        "source": "corsair",
        "channel": "uk",
        "source_product_id": "CH-91D401L-ES",
        "pricing_enabled": true,
        "verified": false
      },
      {
        "source": "corsair",
        "channel": "us",
        "source_product_id": "CH-91D401L-ES",
        "pricing_enabled": true,
        "verified": false
      }
    ]
  }
}
