{
  "opendb_id": "84b79929-be75-4bb2-8940-cbf17b615cd4",
  "switch": "Hall Effect Magnetic",
  "switch_type": "Magnetic",
  "size": "60%",
  "size_other": "None",
  "layout": "ANSI",
  "hot_swappable": true,
  "backlighting": "RGB",
  "features": [],
  "connectivity": ["Wired USB-C", "Wireless 2.4GHz", "Bluetooth"],
  "keycap_material": "PBT",
  "frame_material": "ABS plastic",
  "polling_rate": 8000,
  "battery_capacity": 5000,
  "metadata": {
    "name": "Attack Shark X68 PRO HE Black",
    "manufacturer": "ATTACK SHARK",
    "part_numbers": [],
    "series": "X68HE",
    "variant": "PRO - Black",
    "releaseYear": 2025
  },
  "general_product_information": {
    "manufacturer_url": "https://attackshark.com/products/attack-shark-x68pro-he-wireless-rapid-trigger-keyboard-magnetic-switch?srsltid=AfmBOopiIdXsY6gu3H3q1PN4iYqOuBMU4pXDEimxXzVILVs0nfjpJY14&variant=49999444738346"
  },
  "identifiers": {
    "version": 2,
    "identifiers": [
      {
        "type": "mpn",
        "value": "X68PRO HE",
        "region": "us"
      }
    ],
    "retailer_listings": [
      {
        "source": "amazon",
        "channel": "us",
        "source_product_id": "B0DZT9Z1CN",
        "pricing_enabled": true,
        "verified": true
      }
    ]
  }
}
