{
  "opendb_id": "7421ae0b-50aa-4173-825e-024e2a067b55",
  "layout": "ANSI",
  "features": [],
  "connectivity": [],
  "metadata": {
    "name": "Chester Creek Technologies VisionBoard2 Yellow Wired Standard Keyboard",
    "manufacturer": "Chester Creek Technologies",
    "part_numbers": ["VB2YELLOW"]
  },
  "general_product_information": {},
  "identifiers": {
    "version": 1,
    "identifiers": [
      {
        "type": "mpn",
        "value": "VB2YELLOW",
        "region": "all"
      }
    ],
    "retailer_listings": []
  }
}
