{
  "opendb_id": "47fddedd-a2ab-4a6c-b462-fe56e6fb3a8b",
  "layout": "ANSI",
  "features": [],
  "connectivity": [],
  "metadata": {
    "name": "LexonElec 82 Key Mechanical Keyboard Metal Mechanical Wired Usb Blue Switch Computer Gaming Keyboard With Blue LED Backlit For Computer Gamers (Blue Switch, White)",
    "manufacturer": "LexonElec",
    "part_numbers": ["AK33", "20210416AK"]
  },
  "general_product_information": {},
  "identifiers": {
    "version": 1,
    "identifiers": [
      {
        "type": "ean",
        "value": "6618841679770",
        "region": "all"
      },
      {
        "type": "mpn",
        "value": "20210416AK",
        "region": "all"
      },
      {
        "type": "mpn",
        "value": "AK33",
        "region": "all"
      }
    ],
    "retailer_listings": [
      {
        "source": "amazon",
        "channel": "au",
        "source_product_id": "B079M2QD2R",
        "pricing_enabled": true,
        "verified": true
      },
      {
        "source": "amazon",
        "channel": "be",
        "source_product_id": "B079M2QD2R",
        "pricing_enabled": true,
        "verified": true
      },
      {
        "source": "amazon",
        "channel": "ca",
        "source_product_id": "B079M2QD2R",
        "pricing_enabled": true,
        "verified": true
      },
      {
        "source": "amazon",
        "channel": "de",
        "source_product_id": "B079M2QD2R",
        "pricing_enabled": true,
        "verified": true
      },
      {
        "source": "amazon",
        "channel": "es",
        "source_product_id": "B079M2QD2R",
        "pricing_enabled": true,
        "verified": true
      },
      {
        "source": "amazon",
        "channel": "fr",
        "source_product_id": "B079M2QD2R",
        "pricing_enabled": true,
        "verified": true
      },
      {
        "source": "amazon",
        "channel": "ie",
        "source_product_id": "B079M2QD2R",
        "pricing_enabled": true,
        "verified": true
      },
      {
        "source": "amazon",
        "channel": "it",
        "source_product_id": "B079M2QD2R",
        "pricing_enabled": true,
        "verified": true
      },
      {
        "source": "amazon",
        "channel": "jp",
        "source_product_id": "B079M2QD2R",
        "pricing_enabled": true,
        "verified": true
      },
      {
        "source": "amazon",
        "channel": "nl",
        "source_product_id": "B079M2QD2R",
        "pricing_enabled": true,
        "verified": true
      },
      {
        "source": "amazon",
        "channel": "pl",
        "source_product_id": "B079M2QD2R",
        "pricing_enabled": true,
        "verified": true
      },
      {
        "source": "amazon",
        "channel": "se",
        "source_product_id": "B079M2QD2R",
        "pricing_enabled": true,
        "verified": true
      },
      {
        "source": "amazon",
        "channel": "sg",
        "source_product_id": "B079M2QD2R",
        "pricing_enabled": true,
        "verified": true
      },
      {
        "source": "amazon",
        "channel": "uk",
        "source_product_id": "B079M2QD2R",
        "pricing_enabled": true,
        "verified": true
      },
      {
        "source": "amazon",
        "channel": "us",
        "source_product_id": "B079M2QD2R",
        "pricing_enabled": true,
        "verified": true
      }
    ]
  }
}
