{
  "opendb_id": "daad8426-67e0-4f13-a467-08ccad4b6e94",
  "layout": "ANSI",
  "features": [],
  "connectivity": [],
  "metadata": {
    "name": "Corsair K95 RGB PLATINUM UK Wired Cherry MX Speed Silver Gaming Keyboard",
    "manufacturer": "Corsair",
    "part_numbers": ["CH-9127114-UK"]
  },
  "general_product_information": {},
  "identifiers": {
    "version": 1,
    "identifiers": [
      {
        "type": "mpn",
        "value": "CH-9127114-UK",
        "region": "all"
      }
    ],
    "retailer_listings": []
  }
}
