{
  "opendb_id": "6c7d02fe-de0c-4caf-b791-ea92c07d5818",
  "layout": "ANSI",
  "features": [],
  "connectivity": [],
  "metadata": {
    "name": "A4Tech G800V Wired Gaming Keyboard",
    "manufacturer": "A4Tech",
    "part_numbers": ["G800V"]
  },
  "general_product_information": {},
  "identifiers": {
    "version": 1,
    "identifiers": [
      {
        "type": "mpn",
        "value": "G800V",
        "region": "all"
      }
    ],
    "retailer_listings": []
  }
}
