{
  "opendb_id": "99d48361-ee66-44da-a517-4a7fea8f881f",
  "switch": "Violet",
  "layout": "ANSI",
  "backlighting": "RGB",
  "features": [],
  "connectivity": [],
  "metadata": {
    "name": "KEEBMONKEY WOBKEY Rainy 75 CNC Aluminum HMX/JWK/Cocoa Switches Triple-Mode Connectivity Mechanical Keyboard with Superior Acoustics, No RGB/PP/Gradient Glass/3500mAh/Violet Switch (Lite - Black)",
    "manufacturer": "KEEBMONKEY",
    "part_numbers": ["Lite - Black", "LR75BK"]
  },
  "general_product_information": {},
  "identifiers": {
    "version": 1,
    "identifiers": [
      {
        "type": "ean",
        "value": "0677899444361",
        "region": "all"
      },
      {
        "type": "ean",
        "value": "0677899445832",
        "region": "all"
      },
      {
        "type": "mpn",
        "value": "Lite - Black",
        "region": "all"
      },
      {
        "type": "mpn",
        "value": "LR75BK",
        "region": "all"
      },
      {
        "type": "upc",
        "value": "677899444361",
        "region": "all"
      },
      {
        "type": "upc",
        "value": "677899445832",
        "region": "all"
      }
    ],
    "retailer_listings": [
      {
        "source": "amazon",
        "channel": "au",
        "source_product_id": "B0CS5ZYY9Y",
        "pricing_enabled": true,
        "verified": true
      },
      {
        "source": "amazon",
        "channel": "be",
        "source_product_id": "B0CS5ZYY9Y",
        "pricing_enabled": true,
        "verified": true
      },
      {
        "source": "amazon",
        "channel": "ca",
        "source_product_id": "B0CS5ZYY9Y",
        "pricing_enabled": true,
        "verified": true
      },
      {
        "source": "amazon",
        "channel": "de",
        "source_product_id": "B0CS5ZYY9Y",
        "pricing_enabled": true,
        "verified": true
      },
      {
        "source": "amazon",
        "channel": "es",
        "source_product_id": "B0CS5ZYY9Y",
        "pricing_enabled": true,
        "verified": true
      },
      {
        "source": "amazon",
        "channel": "fr",
        "source_product_id": "B0CS5ZYY9Y",
        "pricing_enabled": true,
        "verified": true
      },
      {
        "source": "amazon",
        "channel": "ie",
        "source_product_id": "B0CS5ZYY9Y",
        "pricing_enabled": true,
        "verified": true
      },
      {
        "source": "amazon",
        "channel": "it",
        "source_product_id": "B0CS5ZYY9Y",
        "pricing_enabled": true,
        "verified": true
      },
      {
        "source": "amazon",
        "channel": "jp",
        "source_product_id": "B0CS5ZYY9Y",
        "pricing_enabled": true,
        "verified": true
      },
      {
        "source": "amazon",
        "channel": "nl",
        "source_product_id": "B0CS5ZYY9Y",
        "pricing_enabled": true,
        "verified": true
      },
      {
        "source": "amazon",
        "channel": "pl",
        "source_product_id": "B0CS5ZYY9Y",
        "pricing_enabled": true,
        "verified": true
      },
      {
        "source": "amazon",
        "channel": "se",
        "source_product_id": "B0CS5ZYY9Y",
        "pricing_enabled": true,
        "verified": true
      },
      {
        "source": "amazon",
        "channel": "sg",
        "source_product_id": "B0CS5ZYY9Y",
        "pricing_enabled": true,
        "verified": true
      },
      {
        "source": "amazon",
        "channel": "uk",
        "source_product_id": "B0CS5ZYY9Y",
        "pricing_enabled": true,
        "verified": true
      },
      {
        "source": "amazon",
        "channel": "us",
        "source_product_id": "B0CS5ZYY9Y",
        "pricing_enabled": true,
        "verified": true
      },
      {
        "source": "cenowarka",
        "channel": "pl",
        "source_product_id": "3719246",
        "pricing_enabled": true,
        "verified": false
      },
      {
        "source": "computer-orbit",
        "channel": "uk",
        "source_product_id": "LR75BK",
        "pricing_enabled": true,
        "verified": false
      },
      {
        "source": "geizhals",
        "channel": "de",
        "source_product_id": "3719246",
        "pricing_enabled": true,
        "verified": false
      },
      {
        "source": "skinflint",
        "channel": "uk",
        "source_product_id": "3719246",
        "pricing_enabled": true,
        "verified": false
      }
    ]
  }
}
